{
 "schema_version": "1.1",
 "run_id": "20261031-snapshot-resume",
 "project_version": "0.5.0",
 "generated_at": "2026-10-31T04:25:20+0700",
 "device": {
  "model": "2406APNFAG",
  "android_release": "16",
  "abi": "aarch64",
  "termux": true,
  "unprivileged": true
 },
 "kernel": {
  "arch": "um/arm64",
  "booted": true,
  "release": "7.2.0-rc4-g169b17ff3f66-dirty",
  "mode": "seccomp",
  "ncpus": 4
 },
 "capabilities": {
  "boot": {
   "ok": true,
   "evidence": "Three real boots of the pinned kernel (7.2.0-rc4-g169b17ff3f66) from a private copy of the Debian+docker image: a fresh boot, then two resumes of the same snapshot, each reaching WEB_UP_MARKER with dockerd and the demo container up."
  },
  "c1_snapshot_records_base": {
   "ok": true,
   "evidence": "snapshot stopped the guest cleanly, wrote snapshots/snap-a.cow and a metadata record whose BASE_SIZE equals the backing image (54140a722974..., sha256 recorded); the file-level gate tests/test-snapshot.sh covers GUEST_UNAME and the remaining fields."
  },
  "c2_resume_restores_filesystem": {
   "ok": true,
   "evidence": "A file written in the guest BEFORE the snapshot (/root/snap-a.txt, content verified by its md5 computed on the host and printed by the guest) was readable AFTER up --from: same md5. Both markers are base64 in the typed command, so the console echo cannot fake them."
  },
  "c2_copy_on_resume_immutable": {
   "ok": true,
   "evidence": "The snapshot COW sha256 was identical after both resumes, and a second marker written during resume 1 produced ZERO occurrences of its md5 during resume 2: the second boot did not see the first boot writes. The daemon log confirms the policy: \"cow: reusing the header ... (resume semantics)\"."
  },
  "c3_list_and_remove": {
   "ok": true,
   "evidence": "'uml4termux snapshots' listed snap-a; 'snapshot --rm snap-a' removed both the COW and the metadata file."
  },
  "c4_refuse_different_image": {
   "ok": true,
   "evidence": "Resuming against a different backing image (a copy, mtime changed) was refused with rc=1 BEFORE any boot: the message names the recorded size/mtime and the observed ones, and no new daemon pid appeared in the registry."
  },
  "base_image_untouched": {
   "ok": true,
   "evidence": "The private copy of the backing image had the same sha256 before and after three boots: guest writes went to the COW (54140a722974... unchanged)."
  },
  "no_leftovers_from_this_run": {
   "ok": true,
   "evidence": "Zero processes belonging to this run work directory after teardown. The device-wide count was 1, which is the operator own runit guest and is reported separately instead of being counted as a failure of this run."
  }
 },
 "verdict": "pass",
 "artifacts": [
  {
   "kind": "other",
   "path": "logs/20261031-snapshot-resume-c-snapshot.json",
   "sha256": "7f6b7340de0d19c13f51ceb76b32720792a995d15616fdb0bfa858aef0005412"
  },
  {
   "kind": "other",
   "path": "logs/20261031-snapshot-resume-harness.out",
   "sha256": "f1423807963873e53c5e376628940db4dfd001619ff4e598e0fe1386e5c80787"
  },
  {
   "kind": "other",
   "path": "logs/20261031-snapshot-resume-snapshot.log",
   "sha256": "0924a163c2cc195f7cc856c8b54916d6f12f2a869c7adbbffb9a84bd1a52b6dc"
  },
  {
   "kind": "other",
   "path": "logs/20261031-snapshot-resume-refuse.log",
   "sha256": "03a28e5342a50dc357205e877ce2968b17d86ba5f5d390f53968a559bf6398e7"
  },
  {
   "kind": "other",
   "path": "logs/20261031-snapshot-resume-snapshots-list.log",
   "sha256": "9d0606bd26727aa7347677cb31814eebb8b76b41e5c71b6e85a1c11de11255bd"
  },
  {
   "kind": "other",
   "path": "logs/20261031-snapshot-resume-up1.log",
   "sha256": "9fcf151c344bb88a1f5f6520e18c06bffb40467cce70478a5bc65add0b88bb49"
  },
  {
   "kind": "other",
   "path": "logs/20261031-snapshot-resume-up2.log",
   "sha256": "0044ec50fb9efc2ecdc25bd6a20623f07c53a2f819bea9c16985e0f17664fcab"
  },
  {
   "kind": "other",
   "path": "logs/20261031-snapshot-resume-up3.log",
   "sha256": "77e26220ac5634dd2e0be88f246f60b1de60ef9bc60e1abc60ea3b94bc1336fd"
  },
  {
   "kind": "console-log",
   "path": "logs/20261031-snapshot-resume-console-boot-2-previous.log",
   "sha256": "0ecce3d9fcf123a8f22dcc0ab309a6b8772e74e3545347c76d82d7a0bfa6acfa"
  },
  {
   "kind": "console-log",
   "path": "logs/20261031-snapshot-resume-console-boot-3-final.log",
   "sha256": "88b1991f3a786f1c02eddc5d6038ac6689c1f48620ef0c5979cd996f0ae99316"
  },
  {
   "kind": "console-log",
   "path": "logs/20261031-snapshot-resume-console-boot-3-previous.log",
   "sha256": "03aa7eb9597ddc1e24de0365e5457dcf442548ee1a7e0d227a60ff9ae61dc9c0"
  }
 ],
 "notes": "Direction C, C1-C4, on the device with three real boots (fresh, resume, resume). The snapshot is COLD state: the filesystem comes back, RAM does not, and resuming costs a boot -- there is no RAM save/restore in this port. This harness needed three fixes before it could measure anything: it must down the instance before each resume (`up` adopts a live daemon and returns 0 without booting), it must archive the console log instead of deleting it (the daemon holds the handle), and every marker must be base64 in the typed command because the console echoes what it is given.",
 "known_limits_observed": [
  "Resume returns the FILESYSTEM only: processes running in the guest do not come back, and the cost is one boot.",
  "Base-image identity is size+mtime by default; the full sha256 is checked only with UML4TERMUX_SNAPSHOT_VERIFY_DIGEST=1 because it reads the whole image.",
  "Gate parity for the boot-path COW policy (reuse vs write) is checked in CI with the cow-ensure hook; this record covers the device behaviour."
 ]
}
