{
  "schema_version": "1.0",
  "project_version": "0.2.0",
  "run_id": "device-20261026-capability-round-2",
  "generated_at": "2026-10-26T19:52:09+0700",
  "device": {
    "model": "2406APNFAG",
    "android_release": "16",
    "abi": "aarch64",
    "termux": true,
    "unprivileged": true
  },
  "host": {
    "gvproxy_version": "v0.9.0",
    "image_gib": 3
  },
  "kernel": {
    "booted": true,
    "arch": "um/arm64",
    "release": "7.2.0-rc4-opt",
    "mode": "seccomp",
    "ncpus": 4
  },
  "capabilities": {
    "boot": {
      "ok": true,
      "boot_seconds_per_round": {
        "cap3": 538,
        "cap4": 218,
        "cap5": 113,
        "cap6b": 112
      },
      "boot_seconds_min": 112,
      "boot_seconds_max": 538,
      "evidence": "each round booted UML fresh (seccomp, 4 vCPU, 1 GiB) and reached its marker; the spread reflects payload weight (apt install and resize2fs inflate cap3/cap4, not the kernel)"
    },
    "i386_images": {
      "ok": true,
      "mechanism": "qemu-user-static + binfmt_misc inside the guest",
      "qemu": "/bin/qemu-i386-static",
      "handler": "/proc/sys/fs/binfmt_misc/qemu-i386",
      "handler_flags": " PF",
      "uname_m_inside_container": "i686",
      "evidence": "cap3 i386_run prints 'i686 I386_RUNS' for i386/alpine",
      "notes": "the guest kernel still has CONFIG_COMPAT off (no native 32-bit); this is user-mode emulation registered through binfmt_misc, which the guest kernel does support"
    },
    "compose": {
      "ok": true,
      "version": "Docker Compose version v2.29.7",
      "services_up": "stack-web-1 stack-worker-1",
      "service_log": "STACK_WEB",
      "evidence": "two-service stack (web + worker with depends_on) came up, web logged STACK_WEB, down -v removed it"
    },
    "buildkit": {
      "ok": true,
      "evidence": "#6 naming to docker.io/library/uml-bk-test 0.0s done #6 DONE 0.7s"
    },
    "cgroup_cpu_limit": {
      "ok": true,
      "inside_container": "50000 100000",
      "meaning": "--cpus 0.5 -> cpu.max '50000 100000' read from inside the container"
    },
    "cgroup_memory_limit": {
      "memory_max": "67108864",
      "anon_rss_oom_kill": {
        "ok": true,
        "oomkilled": "true",
        "exit_code": "137",
        "evidence": "64 MB-limited container killed with SIGKILL (137) while growing an anonymous buffer; the same allocator without a limit peaked at 153223168 bytes and kept running"
      },
      "tmpfs_not_charged": {
        "observed": true,
        "memory_current_during_200m_write": "4849664",
        "memory_peak": "8126464",
        "anon_stat": "anon 98304",
        "file_stat": "file 1720320",
        "config": "CONFIG_CGROUPS=y CONFIG_MEMCG=y # CONFIG_MEMCG_V1 is not set",
        "meaning": "CONFIG_MEMCG=y but CONFIG_MEMCG_KMEM is absent, so tmpfs and page-cache pages are not charged to the container's cgroup: a 200 MB tmpfs write inside a 64 MB-limited container never approached the limit"
      },
      "cgroup_path_note": "the container cgroup lives at /sys/fs/cgroup/docker/<full-id> and is removed when the container exits (cap4 read it too late; cap5 read it while the container ran)"
    },
    "cgroup_io_limit": {
      "ok": false,
      "io_files_present": "io.stat",
      "io_max": "absent",
      "meaning": "the cgroup v2 io controller exposes io.stat only; io.max is absent, so --device-*-bps limits cannot be enforced"
    },
    "ipv6_container_networking": {
      "ok": true,
      "bridge_state_at_network_create": "state DOWN",
      "bridge_state_after_first_container": "state UP",
      "container_addresses": [
        "fd00:9::2",
        "fd00:9::3"
      ],
      "ping_a_to_b": "--- fd00:9::3 ping statistics --- 2 packets transmitted, 2 packets received, 0% packet loss round-trip min/avg/max = 1.426/1.758/2.090 ms",
      "ping_b_to_a": "--- fd00:9::2 ping statistics --- 2 packets transmitted, 2 packets received, 0% packet loss round-trip min/avg/max = 1.205/3.847/6.489 ms",
      "dockerd_error_at_create": "",
      "evidence": "two containers on a user-defined --ipv6 network ping each other over fd00:9::/64 with 0% loss both ways (avg 1.8 / 3.8 ms)",
      "mechanism": "dockerd logs 'Could not add route ... network is down' at network-create time because the bridge is still DOWN; the bridge comes UP when the first container attaches, and the container then receives its address and default route. The daemon error is cosmetic, not fatal.",
      "refutes": "the earlier claim 'IPv6 container networking does not work' (record 20261026-adv2b-corrected-probes.json, KNOWN-LIMITS.md)"
    },
    "ipv4_still_fine": {
      "ok": true,
      "peer_ip": "172.17.0.2",
      "evidence": "2 packets transmitted, 2 packets received, 0% packet loss round-trip min/avg/max = 92.575/94.855/97.135 ms"
    }
  },
  "observed": {
    "cap3": {
      "uname": "Linux 7.2.0-rc4-opt aarch64",
      "net_ipv4": "192.168.127.2/24",
      "dockerd": "up",
      "compose_version": "Docker Compose version v2.29.7",
      "cpu_max_inside": "50000 100000",
      "disk_final": "/dev/ubda 2.9G 1.4G 1.4G 51% /"
    },
    "cap4": {
      "uname": "Linux 7.2.0-rc4-opt aarch64",
      "net_ipv4": "192.168.127.2/24",
      "dockerd": "up",
      "disk_final": "/dev/ubda 2.9G 1.4G 1.4G 51% /"
    },
    "cap5": {
      "uname": "Linux 7.2.0-rc4-opt aarch64",
      "net_ipv4": "192.168.127.2/24",
      "dockerd": "up",
      "memcg_kmem_config": "CONFIG_CGROUPS=y CONFIG_MEMCG=y # CONFIG_MEMCG_V1 is not set",
      "disk_final": "/dev/ubda 2.9G 1.4G 1.4G 51% /"
    },
    "cap6b": {
      "net_ipv4": "192.168.127.2/24",
      "dockerd": "up",
      "disk_final": "/dev/ubda 2.9G 1.4G 1.4G 51% /"
    }
  },
  "known_limits_observed": [
    "no cgroup io.max: only io.stat exists; block-device limits are unenforceable",
    "tmpfs and page cache are not charged to the cgroup (CONFIG_MEMCG_KMEM absent): memory limits only cap anonymous RSS",
    "no native 32-bit userspace (CONFIG_COMPAT off); 32-bit images work only through qemu-user emulation registered in binfmt_misc",
    "no cpuset controller: docker info still warns 'No cpuset support'"
  ],
  "verdict": "pass",
  "notes": "Capability round 2 (cap3..cap6b) closes what round 1 left open: 32-bit images through qemu-user + binfmt_misc, a two-service Compose stack, BuildKit, the cpu and memory cgroup limits including a real OOM kill, and inter-container IPv6. It also retracts the earlier 'IPv6 does not work' claim: the daemon's route-add error at network creation is cosmetic -- the bridge comes UP when the first container attaches. Every value above is parsed from the raw console logs listed in artifacts; nothing is re-typed."
}
