{
  "capabilities": {
    "boot": {
      "ok": true,
      "evidence": "the CI-built kernel+stub pair boots the Debian 12 + Docker image to its docker-init marker with seccomp=on and 4 vCPU; 27 RESULT lines collected from the in-guest capability matrix (cap8-boot1.log)"
    },
    "cgroup_controllers": {
      "ok": true,
      "evidence": "cgroup.controllers = cpuset cpu io memory pids (released kernels exposed only cpu io memory pids); enabling +cpu +memory +pids in cgroup.subtree_control succeeds"
    },
    "config_gaps_closed": {
      "ok": true,
      "evidence": "/proc/config.gz inside the guest shows CONFIG_CPUSETS=y, CONFIG_BLK_CGROUP=y, CONFIG_BLK_DEV_THROTTLING=y, CONFIG_MODULES=y -- all four absent in every released kernel; the docker daemon no longer reports its cpuset warning (docker_cpuset_warning=no)"
    },
    "docker": {
      "ok": true,
      "evidence": "dockerd starts (SERVER=20.10.24+dfsg1 DRIVER=overlay2 CGROUPV=2), a fresh busybox pull through gvproxy NAT/DNS runs (BUSYBOX_RUN_OK), and an inbound published port is reachable from the phone's loopback (curl 127.0.0.1:8123 -> gvproxy-bess-ok) in the same boot (docker-full.log)"
    },
    "memcg_kmem_absent": {
      "ok": false,
      "evidence": "CONFIG_MEMCG_KMEM is still absent in the built config, so tmpfs/page cache stays uncharged (memory.current unchanged after an 80 MB tmpfs write inside a 64 MB group) -- carried over from the released kernel, not a regression; next candidate symbol for the CI config"
    },
    "stub_toolchain_parity": {
      "ok": true,
      "evidence": "the CI stub built with NDK r29 is byte-identical (sha256 731c48d5...) to the released stub_exe; the earlier r27c stub lacked .rela.dyn, differed in 156 disassembly lines, and SIGSEGV'd the first exec'd guest process"
    }
  },
  "device": {
    "model": "2406APNFAG",
    "android_release": "16",
    "abi": "aarch64",
    "termux": true,
    "unprivileged": true
  },
  "generated_at": "2026-10-28T01:45:35+0700",
  "kernel": {
    "arch": "um/arm64",
    "booted": true,
    "release": "7.2.0-rc4-g169b17ff3f66-dirty",
    "mode": "seccomp",
    "ncpus": 4,
    "build": "GitHub Actions run 40535091305 (ubuntu x86_64, NDK r29 29.0.14206865, cross-compiled to aarch64-bionic)",
    "source": "Raymer8639/linux-um-arm64 (packaging fork), config = extracted guest config + CPUSETS + BLK_CGROUP + BLK_DEV_THROTTLING + MODULES",
    "linux_sha256": "d2feb2e37928d59a838859d2893d0f6ed1ce908b474c683a686fa0ddff524f1d",
    "stub_sha256": "731c48d5bf42ef25e26625af6a02627a5d658bf9f67d6f7fc443d6d644d6e52e"
  },
  "known_limits_observed": [
    "no CONFIG_MEMCG_KMEM: tmpfs/page cache uncharged, 80 MB tmpfs write inside a 64 MB group keeps memory.current at 0",
    "io.max retest pending: root-cgroup probe is inconclusive, needs a child-cgroup check with +io in subtree_control",
    "CPUSETS_V1 intentionally off (cgroup v2 cpuset is what matters)"
  ],
  "observed": {
    "matrix_result_lines": 27,
    "boot_marker": "CAP7_MATRIX_DONE (cap8-boot1.log)",
    "dockerd": "SERVER=20.10.24+dfsg1 DRIVER=overlay2 CGROUPV=2 (docker-full.log)",
    "busybox_run": "BUSYBOX_RUN_OK after a fresh pull through gvproxy NAT/DNS",
    "inbound_port": "curl 127.0.0.1:8123 -> gvproxy-bess-ok with the web container up",
    "stale_initramfs_note": "the graphdriver failure in the first full run came from the stale switch8 initramfs environment, not the kernel (cap10 dumped dockerd's log from the failed run)"
  },
  "notes": "First kernel built entirely in CI (no device build needed) that boots and runs Docker on the device. Adopted as the 0.3.0 kernel. Build recipe: .github/workflows/kernel-build.yml; diagnostics in cap7-cap10 boot logs under workspace/uml-forensics/.",
  "project_version": "0.3.0",
  "run_id": "device-ci-kernel-round3-20261027",
  "schema_version": "1.0",
  "verdict": "pass"
}
